{
  "$schema": "http://json-schema.org/draft-07/schema#",
  "type": "object",
  "required": ["formId", "name", "version", "tableName", "fields"],
  "properties": {
    "formId": {
      "type": "string",
      "pattern": "^[a-z0-9-]+$"
    },
    "name": {
      "type": "string",
      "minLength": 1
    },
    "description": {
      "type": "string"
    },
    "version": {
      "type": "string",
      "pattern": "^\\d+\\.\\d+\\.\\d+$"
    },
    "tableName": {
      "type": "string",
      "pattern": "^form_[a-z0-9_]+_submissions$"
    },
    "guestAccessible": {
      "type": "boolean",
      "default": false
    },
    "category": {
      "type": "string"
    },
    "tags": {
      "type": "array",
      "items": {"type": "string"}
    },
    "submitEndpoint": {
      "type": "string",
      "pattern": "^/api/forms/[a-z0-9-]+/submit$"
    },
    "fields": {
      "type": "array",
      "minItems": 1,
      "items": {
        "$ref": "#/definitions/field"
      }
    },
    "results": {
      "type": "object",
      "properties": {
        "display": {
          "type": "array",
          "items": {
            "type": "object",
            "required": ["key", "label"],
            "properties": {
              "key": {"type": "string"},
              "label": {"type": "string"},
              "unit": {"type": "string"}
            }
          }
        },
        "charts": {
          "type": "array",
          "items": {"type": "string"}
        }
      }
    }
  },
  "definitions": {
    "field": {
      "type": "object",
      "required": ["id", "type", "label"],
      "properties": {
        "id": {"type": "string"},
        "type": {
          "type": "string",
          "enum": ["text", "number", "email", "password", "textarea", "select", "radio", "checkbox", "file"]
        },
        "label": {"type": "string"},
        "required": {"type": "boolean", "default": false},
        "placeholder": {"type": "string"},
        "unit": {"type": "string"},
        "min": {"type": "number"},
        "max": {"type": "number"},
        "step": {"type": "number"},
        "options": {
          "type": "array",
          "items": {
            "type": "object",
            "required": ["label", "value"],
            "properties": {
              "label": {"type": "string"},
              "value": {"type": "string"}
            }
          }
        },
        "validation": {
          "type": "object",
          "properties": {
            "required": {"type": "boolean"},
            "min": {"type": "number"},
            "max": {"type": "number"},
            "pattern": {"type": "string"},
            "message": {"type": "string"}
          }
        }
      }
    }
  }
}
